,index,english,translated_from_french,translated_from_german,translated_from_hebrew,translated_from_italian,translated_from_japanese,translated_from_mandarin,translated_from_polish
1,1277,I have to go to sleep.,Je dois aller dormir. | Il faut que j'aille dormir.,Ich muss jetzt schlafen. | Ich muss schlafen.,私は寝る必要があります. | 私は מוכרח ללכת寝る.,Devo andare a dormire. | Io devo andare a dormire.,I must sleepらなければなりません. | そろそろ寝なくちゃ. | 寝なきゃ.,I should go to sleep了. | I must sleep了.,Muszę iść spać.
3,1282,Muiriel is 20 now.,Muiriel je už 20 let.,മുയriel ist jetzt 20.,இவருக்கு 20 வயது. | இவருக்கு 20 வயது.,Muiriel má 20 let adesso. | Muiriel má 20 let ora. | Muiriel má vent'anni ora. | Muiriel má vent'anni adesso.,"ムーリエルは20歳になりました。 | Now,ムーリイエルは20歳だ。",穆里埃尔现在20岁了。,Muiriel má teď 20 let.
4,1283,"The password is ""Muiriel"".",Le mot de passe est « Muiriel ».,"Das Passwort ist ""Muiriel"". | Das Passwort lautet ""Muiriel"". | Das Kennwort lautet ""Muiriel"".","இத்திரைப்படம் ""Muiriel"". | הסיסמה - ""מיוריאל"". | הסיסמה - ""Muiriel"".",| パスワードは「Muiriel」。,"Your password is ""Muiriel"".",パスワードは「Muiriel」 | パスワードは「Muiriel」。,Hasło brzmi „Muiriel”. | Hasło do „Muiriel”.
5,1284,I will be back soon.,我很快就会回来的。 我一分钟后就会回来的。,මම ඉක්මනට ආපහු එන්නම්. මම ඉක්මනට ආපහු එන්නම්. මම ඉක්මනට ආපහු එන්නම්.,ඉක්මනට ආපහු එන්නම්. ඉක්මනට ආපහු එන්නම්. ඉක්මනට ආපහු එන්න.,குறிப்பாக: குறிப்பாக: குறிப்பாக: குறிப்பாக: குறிப்பாக: குறிப்பாக: குறிப்பாக: குறிப்பாக: குறிப்பாக: குறிப்பாக: குறிப்பாக: குறிப்பாக: குறிப்பாக: குறிப்பாக: குறிப்பாக: குறிப்பாக: குறிப்பாக: குறிப்பாக: குறிப்பாக: குறிப்பாக: குறிப்பாக: குறிப்பாக: குறிப்பாக: குறிப்பாக: குறிப்பாக: குறிப்பாக: குறிப்பாக: குறிப்பாக: குறிப்பாக: குறிப்பாக:,I'll be right back. | まもなく私は戻って来ます。 | すぐ戻ります。 | すぐ戻ってきます。 | すぐ戻るよ。 | すぐ戻る。,I'll be back soon.,Zaraz se vracím. | Niedługo wrócę. | Zaraz wrócę.
6,1286,I'm at a loss for words.,Ztratil jsem slova. | Slova mi chybí. | Nenašel jsem slova. | Slova mi chybí.,"Ich finde keine Worte. | Mir fehlen die Worte. | Ich weiß nicht, was ich soll sagen. | Ich bin sprachlos.","Nemám slova. | Nevím, co říct. | Já nevím, co říct. | Já nevím, co říct. | Já nevím, co říct. | Já nevím, co říct.",Sono a corto di parole. | Sono senza parole. | Io sono senza parole.,I don't know what I said. | I was stuck in words. | I was lost in words.,I don't know what to say.,Brak mi słów.
7,1287,This is never going to end.,| | | | | | | | | | | | | | | | | | | | | | | | | | | | | | | | | | | | | | | | | | | | | | | | | | | | | | | | | | | | | | | | | | | | | | | | | | | | | | | | | | | | | | | | | | | | | | | | | |,To nebude nie enden. | Es nimmt kein Ende. | Das hört nie auf! | Das hört nie auf.,یہ לעולם ختم نہیں کریں گے.,Tohle nikdy nekončí. | Tohle nikdy nekončí.,きりがない.,这个永远无法结束。 | 这将永远继续下去。 | 这个永远无法结束。,ముగింపు ఎప్పటికీ.
8,1288,I just don't know what to say.,"Je ne sais simplement pas quoi dire... | Je ne sais pas quoi dire, tout simplement. | Je ne sais quoi dire. | Je ne sais pas quoi dire.","Já prostě nicht weiß, was ich sagen soll.","Já prostě nevím, co říct. Já prostě nevím, co říct. Já prostě nevím, co říct.",Ne tak proprio cosa dire. | Semplicemente non so che dire. | Semplicemente non so che cosa dire. | Semplicemente non so cosa dire. | Non so semplicemente cosa dire.,何と言ったらいいか・・・ | 何とも言いようがないなあ.,I just don't know what to say... | I just don't know what to say.,"Po prostu nie wiem, co powiedzieć. | Zwyczajnie nie wiem, co powiedzieć..."
10,1290,I was in the mountains.,Byla jsem v horách. | Byla jsem v horách. | Byla jsem na horách.,Ich war im Krieg in den Bergen.,Byla jsem v horách. | שהיתי בהרים. | Já byla v horách.,Ero in montagna. | Io ero in montagna.,I was in the mountains.,මම කලින්山里.,Byłem w górach.
11,1291,Is it a recent picture?,Est-ce que c'est une photo récente? | Est-ce une photo récente?,Ist das ein aktuelles Foto?,To je nová fotka?,Je to nedávná fotografie? | Je to nedávná fotografie? | Je to nedávná fotka?,那是最近的照片吗?,ඒක一张近照ද?,Czy aktualne zdjęcie?
12,1292,I don't know if I have the time.,Je ne sais pas si j'ai le temps.,"Nevím, jestli mám čas na to. | Nevím, jestli mám čas. | Nevím, jestli mám čas. | Nevím, jestli mám čas.","Já nevím, jestli mám čas. Já nevím, jestli mám čas na to. Já nevím, jestli mám čas. Já nevím, jestli mám čas na to. Já nevím, jestli mám čas na to.",నాన్ సో se ho tempo.,時間があるか分からない。,I don't know if I have time.,"Nie wiem, czy mam czas."
14,1295,You're in better shape than I am.,Tu es en meilleure forme que moi. | Vous êtes en meilleure forme que moi.,Du bist besser in Form als ich.,Jsi v pořádku? Jsi v pořádku? Jsi v pořádku? Jsi v pořádku? Jsi v pořádku? Jsi v pořádku? Jsi v pořádku? Jsi v pořádku? Jsi v pořádku?,"”“你比我多,你比我多,你比我多,你比我多,你比我多,你比我多,你比我多,它比我多,她比我多。",You're in a better position than me.,ඔයාගේ体型比我的好.,You are in betterj formie than ja.
15,1296,You are in my way.,Tu es sur mon chemin. | Vous êtes sur mon chemin. | Vous vous trouvez en travers de mon chemin. | Tu te trouves en travers de mon chemin.,Du bist mir im Weg.,ඔයා මට බාධා කරනවා!,Sei dalla mia parte.,君は私の邪魔をしている。 | あなたは私の邪魔をしています。,ඔයා挡住了 මගේ පාර.,Stoisz mi na drodze.
16,1298,This will cost €30.,Ça coûtera 30 €. | Ça va faire 30 euros.,Das wird 30 € kosten.,To bude stát 30 eur. | To bude stát 30 eur. | To by mělo stát 30 eur. | To bude stát 30 eur.,| Questo costerà 30 €. | Questa costerà 30 €.,30ユーロになります.,இது 30 கி.மீ.,To będzie kosztowało €30.
17,1299,I make €100 a day.,Je gagne 100 € par jour. | Je gagne cent euros par jour.,Ich verdiene 100 Euro pro Tag.,Vydělám 100 eur za den. | Vydělám 100 eur za den. | Vydělám 100 eur za den. | Vydělám 100 eur za den. | Vydělám 100 eur za den.,Guadagno 100 euro al giorno. | Guadagno 100€ al giorno. | Io guadagno 100€ al giorno. | Io guadagno 100 euro al giorno. | Guadagno cento euro al giorno. | Io guadagno cento euro al giorno. | Io guadagno cento euro al giorno.,I earn 100 Euros a day.,My Day Makes One Hundred Euros | My Day Makes One Hundred Euros,Zarabiam € 100 dziennie.
20,1302,That won't happen.,| Cela ne se produira pas. | Cela ne se produira pas.,Das wird nicht passieren. | Dazu kommt es nicht. | Das wird nicht ereignen. | Das wird nicht geschehen. | Das kommt nicht vor.,それは起こらない。 | 状況.,To se nestane. | To se nestane. | To se nestane.,そんなことは起こらないでしょう。,That won't happen的.,അത് സംഭവിക്കില്ല.
22,1304,I'll do my best not to disturb your studying.,Je ferai de mon mieux pour ne pas perturber tes révisions.,"Ich werde mir Mühe geben, dich nicht beim Lernen zu stören.",| アשתדל לא להפריע לך בלימודיך.,Farò del mio meglio per non disturbare il tuo studio.,Do not interfere with your study.,I'll try not to disturb you review.,Postaram się Ci nie przeszkadzać w nauce.
25,1308,I miss you.,Tu me manques. | Vous me manquez.,मैं तुम्हें भूलता हूँ. मैं आप को भूलता हूँ. मैं आप को भूलता हूँ. तुम मुझे भूल जाते हो.,මම ඔයාට ආදරෙයි. මම ඔයාට ආදරෙයි.,例如: mi manchi. | Mi manca. | Mi missede. | Tu mi manchi. | Lei mi manca. | Voi mi missede. | A me manchi. | A me manca. | A me missede. | A me missede.,会えなくて淋しい. | 君がいなくて寂しいよ. | あなたがいなくて淋しいです.,I miss you. | I miss you. | I miss you. | I miss you.,Tęsknię za Tobą. | Brakuje mi cię. | Tęsknię za tobą.
26,1309,I'll call them tomorrow when I come back.,මම ආපහු එනකොට මම කතා කරන්නම්.,"ഞാന് നാളെ അവരെ വിളിക്കും, ഞാന് തിരിച്ചു വരുമ്പോള്.",| 明日、明日、明日、明日、明日、明日、明日、明日、明日、明日、明日、明日、明日、明日、明日、明日。,Li chiamerò domani quando ritorno. | Le chiamerò domani quando ritorno.,I'll call you tomorrow.,I will contact them when I come back tomorrow.,Zadzwonię do nich jutro kiedy wrócę.
28,1311,You should sleep.,Tu devrais dormir.,Měl bys spát. | Měls spát.,ඔයාට නිදාගන්න වෙනවා. ඔයාට නිදාගන්න වෙනවා. ඔයාට නිදාගන්න වෙනවා. ඔයාට නිදාගන්න වෙනවා. අපිට නිදාගන්න වෙනවා. ඔයාට නිදාගන්න වෙනවා.,Dovresti dormire. | Dovreste dormire. | Dovrebbe dormire. | Tu dovresti dormire. | Lei dovrebbe dormire. | Voi dovreste dormire.,眠った方がいいよ. | 寝た方がいいよ.,You should go to sleep now.,Powinieneś spać.
29,1312,I'm going to go.,Je vais y aller.,Ich gehe.,Já אלך. | Já jdu jít. | Já jdu ven.,Sto per andare. | Ho intenzione di andare. | Andrò. | Io andrò.,| あとで行くね。,මම යනවා.,Zamierzam iść (ang.).
30,1313,I told them to send me another ticket.,Je leur ai dit de m'envoyer un autre billet. | Je leur ai dit de m'envoyer un autre billet.,"Ich sagte ihnen, sie sollen mir ein neues Ticket schicken. | Ich sagte ihnen, sie sollen mir eine neue Fahrkarte schicken.","Řekl jsem jim, aby mi poslali jiný lístek.",”“”“”“”“”“”“”“”“”“”“”“”“”“”“”“”“”“”“”“”“”“”“”“”“”“”“”“”“”“”“”“”“”“”“”“”“”“”“”“”“”“”“”“”“”“”“”“”“”“”“”“”“”“”“”“”“”“”“”“”“”“”“”“”“”“”“”“”“”“”“”“”“”“”“”“”“”“”“”“”“”“”“”“”“”“”“”“”“”“”“”“”“”“”“”“”“”“”“”“”“”“”“”“”“”“”“”“”“”“”“”“”“”“”“”“”“”“”“”“”“”“”“”“”“”“”“”“”“”“”“”“”“”“”“”“”“”“”“”“”“”“”“”“”“”“”“”“”“”“”“”“”“”“”“”“”“”“”“”“”“”“”“”“”“”“”“”“”“”“”“”“”“”“”“”“”“”“”“”“”“”“”“”“”“”“”“”“”“”“”“”“”“”“”“”“,I asked them to send me another ticket.,I ask them to send me a ticket again.,"Chtěl jsem jim poslat další lístek. Chtěl jsem jim poslat další lístek. Chtěl jsem jim poslat další lístek. Chtěl jsem jim říct, aby mi dali další lístek. Chtěl jsem jim říct, aby mi dali další lístek. Chtěl jsem jim říct, aby mi dali další lístek. Chtěl jsem jim říct, aby mi dali další lístek. Chtěl jsem jim říct, aby mi dali další lístek."
33,1316,I once wanted to be an astrophysicist.,Il fut un temps où jsem chtěl být astrofysicien.,Ich wollte mal Astrophysiker werden.,"All'epoca, volevo essere un astrofisico.",Una volta volevo diventare un astrofisico.,"I was a period,天体物理学者になりたかった.",I once thought過當個宇宙物理學家.,Kiedyś chciałem być astrofizykiem.
34,1317,I never liked biology.,Nikdy jsem biologii nelíbil.,Ich mochte Biologie noch nie.,Nikdy jsem neměla ráda biologii.,Non mi è mai piaciuta la biologia. | A me non è mai piaciuta la biologia.,I never liked biology. | I never liked biology.,I never liked biology.,Nigdy nie lubiłem biologii.
35,1318,The last person I told my idea to thought I was nuts.,"Poslední osoba, se kterou jsem vyprávěl o své myšlence, si myslela, že jsem cinglé.","Die letzte Person, der ich meine Idee erzählt habe, dachte, ich wäre bekloppt.","Poslední člověk, který jsem mu vyprávěl svůj nápad, si myslel, že jsem zasranej.",L'ultima persona a cui ho raccontato la mia idea ha pensato che io fossi pazzo. | L'ultima persona a cui ho raccontato la mia idea ha pensato che io fossi pazzo.,"It seems that I finally thought that the person who told me his thoughts, me気違いだ.",I think I'm crazy.,"Ostatnia osoba, której opowiedziałem o swoim pomyśle uznała mnie za wariata."
37,1320,It is unfortunately true.,To je bohužel pravda.,Unglücklicherweise stimmt es. | Unglücklicherweise ist es wahr. | Das stimmt leider.,^ a b c d e f g a g h o l l o n o n o n | オリジナルよりアーカイブ・ドキュメンタリー・ドキュメンタリー,Je to bohužel pravda. | Je to bohužel pravda. | Je to bohužel pravda. | Je to bohužel pravda.,残念ながらそれは本当です。,"Škoda, že je to opravdu.",අවාසනාවට ඇත්තට.
39,1322,Most people think I'm crazy.,La plupart des gens pensent que je suis fou. | La plupart des gens pensent que je suis cinglé.,"Die meisten Leute denken, ich sei verrückt.","Většina lidí si myslí, že jsem blázen. | Většina lidí si myslí, že jsem blázen.","Většina lidí si myslí, že jsem blázen.",Most people think I'm mistaken.,Most people think I'm crazy.,"Most people sądzi, że jestem szalony. | Most people sądzi, że zwariowałem."
42,1325,He's kicking me!,Il me donne des coups de pied!,Er tritt mich!,అతను בועט בי!,Mi sta calciando! | Lui mi sta calciando!,ඔහු මට පයින් ගහනවා!,他在踢我!,Na mě kopie!
43,1326,Are you sure?,Est-ce que tu es sûr? | Es-tu sûr? | Es-tu sûre? | Êtes-vous sûr? | Êtes-vous sûre? | Êtes-vous sûres? | Êtes-vous sûrs? | Êtes-vous sûrs? | Êtes-vous sûr? | Es-tu sûr? | Êtes-vous sûrs? | Êtes-vous sûres?,Ar esate saugūs? | Ar esate saugūs?,אתה בטוח? | אתה בטוח בזה? | בטוח? | האם אתה בטוח? | האם אתה חושב כך? | את בטוחה? | אתה בטוח? | האם אתה בטוח? | האם אתה בטוח?,Sei sicuro? | Lei è sicura?,本当? | 本気?,你肯定吗? | 你确定吗? | 你确定?,Jesteś pewien? | Jesteś pewna?
45,1328,"Oh, there's a butterfly!","Oh, il y a un papillon! | Oh, un papillon! | Oh, il y a un papillon!","ഓ, da ist ein Schmetterling!",| あああ! あああ! あああ! あああ!,"ఓహ్, ఒక farfalla ఉంది!",あ!蝶々がいる! | あ、蝶々がいる。 | あっ、ちょうちょだ!,哦!有一只蝴蝶!,"Och, tam jest motyl!"
46,1329,Hurry up.,Dépêche-toi! | Dépêche-toi. | Grouille! | Vite! | Pressez-vous! | Fiça! | Magne-toi! | Magnez-vous!,Beeil dich! Beeil dich. | Mach hin!,♫♫,Svelto! Sbrigati! Sbrigatevi!,"急いで! | 急ぎなさい. | さあ,急いで. | 早く! | 急げ!",快点!快点! 快点! 快点!,ඉක්මන් කරන්න!
47,1330,It doesn't surprise me.,| Cela ne me surprend pas. | Cela ne me surprend pas.,Es überrascht mich nicht. | Das überrascht mich nicht.,To mě nepřekvapí. | To mě nepřekvapí.,Není to překvapení.,驚くことではないね.,这并不让我感到惊讶。,To me nie zaskakuje. | Jakoś to mnie nie dziwi.
49,1333,It depends on the context.,Ca dépend du contexte.,Das kommt auf den Zusammenhang an. | Das hängt vom Zusammenhang ab. | Das hängt vom Kontext ab.,संदर्भ में निर्भर करता है.,Záleží na kontextu.,ඒක 文脈による.,这要看情况. | 这得看情况.,Zależy od kontekstu.
51,1335,That's the stupidest thing I've ever said.,To je la chose la plus stupide que j'ai jamais dit.,"Das ist das Dümmste, was ich je gesagt habe.",یہ בדבר הכי מטופש שאמרתי אי פעם ہے.,"To je ta nejblbější věc, co jsem kdy řekl. | To je ta nejblbější věc, co jsem kdy řekl.",I've never said anything like that.,That's the stupidest thing I ever said. | That's the stupidest thing I ever said.,"నేను ఎప్పుడూ చెప్పారు সবচেয়ে stupidsza rzecz, కు."
53,1337,"When I grow up, I want to be a king.","Když budu velký, chci být králem. | Když budu velký, chci být králem.","Wenn ich groß bin, will ich ein König sein.","Chci být králem, když zvětším. | Když zvětším, chci být králem.","""When sarò grande, voglio essere un re. | Da grande voglio fare il re.",I want to be a king.,I grew up after thinking當國王.,"Až dorosnu, chci být králem."
56,1340,So what?,"A pak? | Eh bien, what? | A tedy? | A pak? | A?",Na und? | Ja und?,"तो क्या? | तो??? | נו, तो क्या? | ובכן?",E allora? | E quindi?,ඒක මොකක්?,那又איך?,No i co? | No i?
61,1345,I've always wondered what it'd be like to have siblings.,මම හැමතිස්සෙම අහනවා මොකද වෙන්නේ කියලා සහෝදර සහෝදරියන් ඉන්න එක ගැන.,"Ich habe mich immer gefragt, wie es wäre, Geschwister zu haben.","Vždycky jsem se přemýšlel, jak se cítíš, kdyžיש אח או אחות.","Vždycky jsem se zeptal, jak by to bylo mít bráchy nebo sestry. Vždycky jsem se zeptal, jak by to bylo mít bráchy nebo sestry. Vždycky jsem se zeptal, jak by to bylo mít bráchy nebo sestry. Vždycky jsem se zeptal, jak by to bylo mít bráchy nebo sestry.",I always wonder what it would be like to be a brother.,我总是想有兄弟姐妹会怎么样。,"Zawsze zastanawiałem się, jak to jest mieć rodzeństwo."
63,1347,It would take forever for me to explain everything.,"To by mě přivedlo věčnost k tomu, abych všechno vysvětlil.","Es würde ewig dauern, alles zu erklären. | Um alles zu erklären würde ich ewig brauchen.",| I need links to explain everything. | I need links to explain everything.,എല്ലാം വിശദീകരിക്കാന് ഒരു ജീവിതം വേണം.,It is impossible to explain everything until when it will take.,"I even say上三天三夜,恐怕也不能把一切解释清楚. | 要都解释的话,需要一辈子的时间.","Potrzebna wieczność, żeby wszystko wytłumaczyć."
64,1348,That's because you're a girl.,| C'est parce que tu es une fille. | C'est parce que t'es une nana.,"Das liegt daran, dass du ein Mädchen bist.",| それはあなたが女の子であるからである。,"Je to proto, že jsi holka. | To je proto, že jsi holka. | Je to proto, že jsi holka.",మీరు అమ్మాయి ఎందుకంటే యో.,ඒ මොකද ඔයා කෙල්ලෙක් නිසා.,"To proto, že jsi holka."
79,1363,I thought you liked to learn new things.,Je pensais que tu aimais apprendre de nouvelles choses. | Je croyais que tu aimais apprendre de nouvelles choses.,"Ich dachte, du würdest gerne neue Sachen lernen.",你喜欢学新东西。,Pensavo che ti piacesse imparare cose nuove.,You thought you wanted to study something new.,I think you like to learn new things.,I thought you'd want to learn something new. | I thought you'd want to learn something new.
80,1364,Most people write about their daily life.,La plupart des gens écrivent à propos de leur vie quotidienne.,Die meisten Menschen schreiben über ihr Alltagsleben.,A maioria das pessoas escrevem sobre a vida do seu dia-a-dia.,Większość ludzi pisze o swoim codziennym życiu.,Many people write about everyday things. | Most people write about everyday life.,Most people write things about their daily life.,Większość osób pisze o swoim codziennym życiu.
82,1366,"In order to do that, you have to take risks.","Pour faire cela, il te faut prendre des risques.","Pour ce faire, vous devez prendre des risques. | Pour ce faire, vous devez prendre des risques. | Pour ce faire, vous devez prendre des risques. | Pour cela, vous devez prendre des risques. | Pour cela, vous devez prendre des risques.","To do this, עלך ליטול סיכונים.","Um dies zu tun, muss man riskieren.","In order to do that, you must risk it.","要这么做,你需要冒险。","Aby to zrobić, trzeba podjąć ryzyko."
84,1368,Why do you ask?,നീയെന്തിനാ ആവശ്യപ്പെടുന്നത്?,Why fragst du? | Why ask ihr?,Proč se ptáš? | Proč se ptáš?,Perché lo chiedi?,なぜ聞くの? | なぜ聞くの?,ඔයා මොනාද මේ幹 අහන්නේ?,Czemu pytasz? | Dlaczego pytasz?
89,1373,How long did you stay?,Combien de temps es-tu restée? | Combien de temps es-tu resté? | Combien de temps êtes-vous restée? | Combien de temps êtes-vous resté? | Combien de temps êtes-vous restées? | Combien de temps êtes-vous restées? | Combien de temps êtes-vous restés? | Combien de temps y as-tu séjourné? | Combien de temps y avez-vous séjourné?,Wie lange bist du geblieben? | Wie lange seid ihr geblieben? | Wie lange sind Sie geblieben?,Jak dlouho zůstaneš?,Jaký čas jsi zůstala? | Jaký čas jsi zůstala? | Jaký čas je zůstala? | Jaký čas jsi zůstala? | Jaký čas jsi zůstala? | Jaký čas je zůstala? | Jaký čas jsi byla? | Jaký čas jsi byla? | Jaký čas jsi byla? | Jaký čas jsi byla? | Jaký čas jsi byla? | Jaký čas jsi byla? | Jaký čas jsi byla?,කොච්චර වෙලාද?,You Waited How Long? | You Where Waited How Long?,Jak długo stoisz?
95,1379,That is intriguing.,ඒක සිත්ගන්නා සුළුයි.,Das macht neugierig.,| それは刺激する ענין。,Je intrigantní. | Quello è intrigante. | Quella è intrigante.,അത് രസകരമാണ്.,那真有趣.,intrygujące కు.
102,1386,I didn't like it.,Je n'ai pas aimé. | Ça ne me plaisait pas.,Mir hat es nicht gefallen. | Ich mochte es nicht.,Nelíbilo se mi to. | Nelíbilo se mi to. | Nelíbilo se mi to.,Ne mi è piaciuto. | Non mi è piaciuta. | A me non è piaciuto. | A me non è piaciuta. | No mi è piaciuto. | A me non è piaciuta.,I didn't like it.,我没有喜欢过。,Nie podobało mi się. | Nie podobało mi się.
111,1395,I have to go to bed.,Je dois aller au lit. | Je dois aller dormir.,Musím jít do postele. Musím jít do postele. Musím jít spát.,"我必须去睡觉,我必须去睡觉,我必须去睡觉。",Devo andare a letto. | Io devo andare a letto.,I must sleep. | もう寝なくちゃ. | 寝ないと! | 寝なきゃ. | 寝なくちゃ.,I should go to bed. | I should go to bed.,Muszę iść spać.
118,1402,That wasn't my intention.,నా ఉద్దేశ్యం కాదు.,Das war nicht meine Absicht.,Neměl jsem to v úmyslu. - Neměl jsem to v úmyslu.,Non era mia intenzione.,i didn't mean that.,It's not my intention.It's not my intention.It's not my intention.,Neměl jsem takový záměr.
119,1403,Thanks for your explanation.,Díky za vysvětlení. | Díky za vaše vysvětlení. | Díky za vaše vysvětlení.,Danke für Ihre Erklärung. | Danke für Ihre Erklärung.,^ a b c d e f g a g a h o l o n o n | Thank you for explaining it.,"谢谢你解释的,谢谢你解释的,谢谢你解释的。",Thank you for explainしてくれて.,谢谢你的解释。,"Dziękuję za wyjaśnienie. | Dziękuję, że mi to wyjaśniłeś."
123,1408,I don't know what you mean.,Já ne sais pas ce que tu chceš dire. | Já ne sais pas ce que vous voulez dire.,"Já nevím, byl jsi můjst.",I don't know what you mean. | I don't know what you mean.,Ne tak cosa intendi. | Ne tak cosa intende. | Ne tak cosa intendete.,I don't know what to say. | 何が言いたいのか分かんないんだけど。,I don't know what you mean. | I don't know what you mean.,"Nie wiem, co masz na myśli. | Nie rozumiem, co masz na myśli."
132,1417,I need to ask you a silly question.,"നിനക്കൊരു ചോദ്യം ചോദിക്കണ്ട, വിഡ്ഢി.",ഞാന് നിനക്കൊരു മണ്ടന് ചോദ്യം ചോദിക്കണം.,I should ask you a stupid question. | I should ask you a stupid question. | I should ask question אווילית.,Devo farti una domanda stupida.,バカな質問があるんだ.,I must ask you a stupid question.,Muszę ci zadać głupie pytanie.
