,index,english,translated_from_french,translated_from_german,translated_from_hebrew,translated_from_italian,translated_from_japanese,translated_from_mandarin,translated_from_polish
143227,410779,Am I wrong?,Ai-je tort? | Me trompé-je? | Est-ce que je me trompe?,Hab ich nicht Recht? | Irre ich mich? | Hab ich unrecht? | Bin ich im Unrecht?,私は間違っていますか? | 私は大丈夫ではありませんか。,Mi sto sbagliando? | Mi sbaglio? | Ho torto?,| 私は間違っていますか?,මම වැරදිද?,Czy nie mam racji?
143228,410780,We need your help.,Nous avons besoin de votre aide. | Nous avons besoin de ton aide.,Potřebujeme tvou pomoc. Potřebujeme tvou pomoc. Potřebujeme tvou pomoc.,ہم تمہاری مدد کی ضرورت ہے.,ഞങ്ങള് ക്ക് നിന് റെ സഹായം ആവശ്യമുണ്ട്.,We need your help.,We Need Your Help.,Potrzebujemy twojej pomocy.
143316,411238,I can't remember his name.,Je ne peux pas me rappeler son nom. | Je ne me souviens pas de son nom.,Ich weiß seinen Namen nicht mehr. | Ich kann mich nicht an seinen Namen erinnern.,I can't remember my name. I can't remember my name. I can't remember my name. I can't remember my name. I can't remember my name. I can't remember my name. I can't remember what my name is. I can't remember my name. I can't remember my name.,| Io non riesco a ricordare il suo nome.,I can't remember his name.I can't remember his name.I can't remember his name.,මට එයාගේ නම මතක නෑ.,Nie mogę zapamiętać jego imienia. | Nie pamiętam jego imienia.
143324,411285,I'll pay.,Je paierai. | Je paie.,Ich werde zahlen.,私は支払う。 | 支払う。,| Pagherò io.,I'll pay. I'll pay.,මම සල්ලි දෙන්නම්.,Ja zapłacę.
143344,411667,You're right.,| You have reason. | You have reason.,"நீரே, நீரே, நீரே, நீரே, நீரே, நீரே, நீரே.","""நீங்கள் உண்மையாளர்களாக இருக்கிறீர்கள்.",Hai ragione. | Voi avete ragione. | Avete ragione.,| おっしゃる通りです。,You are right. | You have reason. | 你说的对. | 你才对.,ඔයා හරි.
143440,412026,I was a student at that time.,Byla jsem tehdy vysokoškolačka. | Byla jsem tehdy vysokoškolačka. | Byla jsem tehdy vysokoškolačka.,Ich war zu der Zeit Student. | Ich war zu jener Zeit Student. | Zu dieser Zeit war ich Student.,V té době jsem byl studentem.,Já jsem jeden student všech dob. Já jsem jeden student všech dob. Já jsem jeden student všech dob. Já jsem jeden student všech dob.,I was a student at the time.,我当时是学生。,Byłem w tym czasie studentem.
143498,413058,Are you married?,Êtes-vous marié? | Es-tu marié? | Es-tu mariée?,Sind Sie verheiratet? | Bist du verheiratet?,Jsi ženatý? Jsi ženatý? Jsi ženatý? Jsi ženatý? Jsi ženatý?,Jsi vdaná? | Jsi vdaná? | Lei è vdaná? | Jsi vdaná? | Jsi vdaná? | È vdaná? | È vdaná? | Lei è vdaná? | Jsi vdaná? | Voi siete vdaná? | Jsi vdaná? | Voi siete vdaná? | Voi siete vdaná?,කසාද බඳිනවා.,ඔයා වැඩ කලාද?,Jsi ženatý? | Jsi manželatką? | Czy pan je ženatý? | Czy jsi manželatką?
143529,413611,No problem!,Aucun problème! | Pas de problème! | Aucun problème! | De rien! | Pas de problème!,کوئی مسئلہ نہیں!,問題ありません! | זאת לא問題!,کوئی مسئلہ نہیں.,problemないよ. | 大丈夫です。 | お安い御用です。,没问题!,Žaden problem! | Nie ma sprawy! | Nie ma problemu! | W porządku!
143534,413731,"One, two, three, four, five, six, seven, eight, nine, ten.",یک ، دو ، سه ، چهار ، پنج ، شش ، هفت ، هشت ، نه ، نه ، ده.,"Eens, twee, drie, vier, vijf, zes, zeven, acht, neun, tien.","ఒకటి రెండు, రెండు, మూడు, నాలుగు, ఐదు, ఆరు, ఏడు, ఎనిమిది, తొమ్మిది, పది.","Uno, due, tre, quattro, cinque, sei, sette, otto, nove, dieci.","One, Two, Three, Four, Five, Six, Seven, Eight, Nine, Ten. | One, Two, Three, Four, Five, Six, Seven, Eight, Nine, Ten.","1, 2, 3, 4, 5, 6, 7, 8, 9, 10.","Eén, twee, drie, vier, vijf, zes, zeven, acht, negen, negen, tien."
143539,413767,Come home.,Viens à la maison.,Kommt heim! | Komm heim!,එන්න ගෙදරට.,Vieni a casa. | Venga a casa. | Venite a casa.,| 家に来いよ。 | 帰ってきなさい。 | 帰ってこい。 | 家に戻ってきなさい。,ගෙදර යන්න.,Chodź do domu.
143548,413820,"Good evening, how are you?","Bonsoir, comment allez-vous? | Bonsoir, comment ça va? | Bonsoir, ça va? | Bonsoir, comment allez-vous?","ശുഭരാത്രി, എങ്ങനെയുണ്ട്?","ערב טוב, מה שלומך?","Buonasera, přijď do státu?",こんばんは.ご機嫌いかが?,"晚上好,你好吗?","Dobry wieczór, co słychać u pani? | Dobry wieczór, co słychać u pani?"
143549,413821,What's this?,Co to je? | Co to je? | Co to je? | Co to je?,Was ist das? | Was ist das hier? | Was ist das für ein Ding?,Co to je?!,Co je tohle? | Co je tohle? | Co je tohle? | Co je tohle?,何ですか。 | これ何? | これは何ですか。 | 何だこりゃ? | これはなーに? | これは何ですか? | これは何ありますか。 | これは何ござるか。 | これは何ございますか。 | 何これ? | これは何ですか? | 何だこれ?,क्या है? | क्या है? | क्या है? | क्या है? | क्या है चीज़? | क्या है?,ఏం పరిహాసాస్పదం?
143557,413831,I live near here.,Je vis à proximité. | Je vis près d'ici.,Ich wohne in der Nähe. | Ich wohne hier in der Nähe.,මම මෙහාට එනවා.,Já žiju kolem. Já žiju kolem. Já bydlím kolem. Já bydlím kolem. Já bydlím kolem.,I live in this neighborhood. | I live in this neighborhood.,我住在那附近。,Mieszkam niedaleko.
143781,416367,Where are you going?,Où vas-tu? | Où est-ce que vous allez? | Où allez-vous? | Où te rends-tu? | Où vous rendez-vous?,तुम कहाँ जा रहे हो? | तुम कहाँ जा रहे हो? | तुम कहाँ जा रहे हो? | तुम कहाँ जा रहे हो? | तुम कहाँ जा रहे हो? | तुम कहाँ जा रहे हो?,לאן אתה הולך? | לאן אתה הולך? | לאן אתה הולך? | לאן אתה הולך? | לאן מועדות פניך? | לאן אתן הולכות?,ドーフ ヴァイ? | ドーフ ステイ アンドンド? | ドーフ ステイ アンドンドンド? | ドーフ州 アンドンドンドンド?,Where are you going? | Where are you going? | Where are you going? | Where are you going? | Where are you going? | Where are you going? | Where are you going?,你去哪里? | 你要去哪里? | 你们去哪里? | 你们去哪里? | 你们去哪里? | 你去哪裏呀?,Gdzie idziesz? | Gdzie idziesz?
143902,417801,My eyes hurt.,| J'ai mal aux yeux. | J'ai mal aux yeux.,Moje oči schmerzen. | Meine Augen tun weh. | Mir tun die Augen weh.,මට ඇස් රිදෙනවා.,Mi fannoపురుషుడుGli-ఐస్.,目が痛いです. | 目が痛い.,我的眼睛疼我的眼睛疼我的眼睛疼。,Oczy mnie bolą. | Bolą mnie oczy.
143905,417891,I have a sore throat.,J'ai mal à la gorge.,Ich habe Halsweh. | Ich habe Halsschmerzen. | Ich habe einen wunden Hals.,എന് റെ കഴുത്ത് വേദനിക്കുന്നു.,பாலின விகிதம்: பாலின விகிதம் ஆண் விகிதம் பெண் விகிதம் பெண் விகிதம் பெண் விகிதம்,喉が痛いんです。 | 喉が痛い。 | のどが痛いです。,මගේ 喉咙痛.,Gardło mnie boli. | Boli mnie gardło.
143935,418475,You idiot!,Espèce d'idiot! | Espèce d'imbécile! | Idiote!,මෝඩයා!,| טיפש שכמותך!,මෝඩයා!,このおたんこなす! | このばかやろう.,මෝඩයා!,ടാ തെണ്ടി!
144218,424848,I know her.,Je la connais.,Ich kenne sie.,Já ji znám.,La conosco. | Io la conosco.,I know her.,මම එයාව දන්නවා.,Znam ją.
144290,425148,We often play chess.,Nous jouons souvent aux échecs.,Wir spielen oft Schach.,Мы часто играем в шахматы.,| Noi giochiamo spesso a scacchi.,We よくチェスをします.,我们经常下棋。,Často gramy w szachy.
144443,426950,Good night!,ശുഭരാത്രി!,Gute Nacht! | Gute Nacht.,ליל מנוחה. | לילה טוב!,Buona notte!,おやすみなさい. | おやすみ.,晚安!,Dobranoc! | Dobrej nocy. | Dobranoc.
144560,428402,What time is it?,"Jaká je hodina? | Jaká je hodina teď? | Jaká je hodina teď? | Jaká je hodina, tam? | Jaká je hodina teď? | Máš čas? | Jaká je hodina tam? | Jaká je hodina, tam? | Jaká je hodina, tam? | Jaká je hodina jako ty?",Wie viel Uhr ist es? | Wie spät ist es? | Wie viel Uhr ist es? | Wie viel Uhr ist es jetzt? | Wie viel Uhr ist es gerade? | Wie spät ist es jetzt?,| What the hour now?,何时醒来? 何时醒来? 何时醒来? 何时醒来? 何时醒来? 何时醒来? 何时醒来?,何時? | 今、何時? | 何時? | 何時? | いま何時? | 何時?,நேபாளத்தில் நேபாளத்தில் நேபாளத்தில் நேபாளத்தில் நேபாளத்தில் நேபாளத்தில் நேபாளத்தில் நேபாளத்தில்,Która jest godzina? | Która godzina?
144791,430925,She is dead.,Elle est morte.,Sie ist tot.,ఆమె מתה.,Je mrtvá. | Lei è morta.,ඇය මැරිලා.,ඇය මැරුණා.,Ona nie žije.
144819,431539,I'm bored.,Je m'ennuie.,Ich bin gelangweilt. | Mir ist langweilig. | Ich langweile mich. | Ich habe Langeweile.,משעמם לי.,"我讨厌,我讨厌,我讨厌,我讨厌,我讨厌,我讨厌,我讨厌。",退屈しちゃったよ. | 退屈だなあ. | 退屈だな〜.,මම ගොඩක් නිශ්ශබ්දයි.,Nudzi mi się. | Nudzę się.
144848,432340,I was a teacher.,J'étais professeur. | J'étais professeur.,Byla jsem učitelka. Byla jsem učitelka. Byla jsem učitelka.,私は先生でした. | 私は先生でした.,Ero insegnante.,私は教師でした。,我是老师。,Byłem nauczycielem. | Byłam nauczycielką.
144962,433423,What did you say?,Qu'avez-vous dit? | Qu'as-tu dit? | Plaît-il? | Qu'as-tu dit? | Qu'est-ce que tu as dit?,Was hast du gesagt? Was haben Sie gesagt? Was sagten Sie? Was sagtest du?,| What did you say?,Co jsi řekl? | Co jsi řekl? | Co jsi řekl? | Co jsi řekl? | Co jsi řekl? | Co jsi řekl? | Co jsi řekl? | Co jsi řekl?,♪ ♪ ♪ ♪,You say what? | You say what?,Co powiedziałeś? | Co powiedziałeś?
144965,433457,God exists.,ദൈവമുണ്ട്.,Už existuje.,خدا موجود ہے.,Dio existuje.,God exists.,දෙවියෝ ඉන්නවා.,خدا موجود ہے.
144967,433468,I understand.,Je comprends.,මට තේරෙනවා.,Já chápu. | Já מבינה.,Capisco. | Já capisco. | Comprendo. | Já comprendo.,I know. | なるほど. | 分かった! | わかったぞ! | わかりました. | 分かったわよ. | わかりました. | かしこまりました.,"我明白了,我明白了,我明白了。",Rozumiem.
144968,433472,I got it.,J'ai compris. | J'ai capté.,Já jsem to pochopil. Já jsem to dostal. Já to mám.,Rozumím. | קלטתי.,Rozumím. Rozumím. Rozumím. Rozumím. Rozumím.,了解. | 分かったわよ.,明白了。,Złapałem!
144975,433491,Go away.,வார்ப்புரு: வார்ப்புரு:Va te faire foutre! | Fous le camp! | Pars! | Dégage! | Fous le camp! | Pars d'ici. | Va-t'en! | Disparais! | Déguerpissez. | Bouge! | Décampez! | Décampe! | Cassez-vous. | Allez-vous-en.,"""நீ போய் விடு! | உன்னை இழிவுபடுத்து! | நீ போய் விடு! | நீ போய் விடு! | நீ போய் விடு! | நீ போய் விடு! | நீ போய் விடு! | நீ போய் விடு! | நீ போய் விடு! | நீ போய் விடு! | நீ போய் விடு!","இக்கோயிலில் அமைந்துள்ள அருங்காட்சியகங்கள்: அருங்காட்சியகம், அருங்காட்சியகம், அருங்காட்சியகம், அருங்காட்சியகம், அருங்காட்சியகம்.",Vattene. | Se ne vada. | Andatevene. | Vai via. | Andate via. | Vada via.,| あっちへ行け! | 消え失せろ。,走開! | 走開.,Idź sobie. | Odejdź.
144976,433492,Of course.,In: Bien sûr. | Pour sûr.,సహజంగానే.,ఖచ్చితంగా.,ఖచ్చితంగా.,Of courseさ. | Of courseです. | Of course. | Of courseだよ! | Of course! | 当たり前だ.,当然。 当然了。 当然是的。 当然是的。,వాస్తవానికి.
144982,433502,Don't move.,Ne bougez pas. | Ne bouge pas.,നീ അനങ്ങരുത്! നീ അനങ്ങരുത്!,♪ ♪,आप नहीं चल सकते. आप नहीं चल सकते. आप नहीं चल सकते. आप नहीं चल सकते.,動くな! | 動かないで. | 動くな.,不要动。 | 不要动. | 別動。,Nie ruszaj się.
144984,433504,Excuse me.,Omlouvám se. Omlouvám se.,Es tut mir leid | Entschuldigung! | Entschuldigung. | Entschuldigen Sie! | Verzeihung.,क्षमा. | סלח לי. | סלחי לי. | סלחו לי. | תסלח לי. | ברשותך.,Scusatemi. | Scusami. | Mi scusi.,"すみません。 | ちょっと失礼。 | あのー,失礼ですが。 | すみません。 | 失礼します。 | すいません。 | ちょっとすみません。 | では失礼します。",ごめんなさい...... | 对不起。,Przepraszam.
144986,433510,Wonderful!,Merveilleux! | Magnifique! | À la bonne heure! | Génial! | Super! | Excellent! | Formidable! | Très bien! | Quelle merveille! | Sensass! | C'est magnifique. | C'est merveilleux!,Wunderbar! | Herrlich!,素晴らしい! | יופי!,Magnifico! | Meraviglioso!,すごいぞ! | すっげー!,නියමයි!,Cudownie! | Cudowny | Cudowna | Świetnie!
144987,433511,Fantastic!,Fantastique! | Sensass! | Fantastique!,Fantastisch! | Ganz toll!,නියමයි!,නියමයි!,すっげー!,好棒! | 素晴らしい!,Fantastyczny!
144993,433518,Go away!,Dégage! | Pars! | Déguerpissez. | Bouge! | Décampez! | Décampe! | Cassez-vous. | Allez-vous-en! | Va-t'en!,Geh weg! | Hau ab! | Verschwinde! | Verdufte! | Mach dich fort! | Zieh Leine! | Mach dich vom Acker! | Verzieh dich! | Verkrümele dich! | Troll dich! | Zisch ab! | Pack dich! | Mach ’ne Fliege! | Schwirr ab! | Mach die Sause! | Scher dich weg! | Scher dich fort! | Gehe weg!,கர்த்தர்: கர்த்தர்! கர்த்தர்! கர்த்தர்! கர்த்தர்! கர்த்தர்! கர்த்தர்!,Vattene! | Andatevene! | Vai via! | Se ne vada! | Vada via!,向こうへ行け!| あっちへ行け!| 離れろ.,走開!|  Rolling!,Odejdi odsud. | Odejdi odsud!
145014,433594,Try it again.,再试一次。再试一次。再试一次。再试一次。再试一次。再试一次。再试一次。,Zkuste to ještě jednou. | Zkuste to ještě einmal! | Probier es noch mal. | Probiert es noch mal.,दोबारा कोशिश करो. दोबारा कोशिश करो. दोबारा कोशिश करो. दोबारा कोशिश करो. दोबारा कोशिश करो. दोबारा कोशिश करो. दोबारा कोशिश करो. दोबारा कोशिश करो. दोबारा कोशिश करो. दोबारा कोशिश करो. दोबारा कोशिश करो. दोबारा कोशिश करो. दोबारा कोशिश करो.,Provaci ancora. | Provaci di nuovo. | Provateci ancora. | Provateci di nuovo. | Ci provi ancora. | Ci provi di nuovo.,もう1度やってみなさい.,再試一次. | 再試一下.,Spróbuj jeszcze raz.
145027,433613,I have no money.,ജീനായ് പാ ദargent.,Ich habe kein Geld.,මට සල්ලි නෑ.,Ne ho soldi. | Io non ho soldi. | Non ho denaro. | Io non ho denaro.,I don't have any money. | 金欠なんだ. | 金がないんだよ. | 金がないんだよ.,I didn't have money. | I didn't have money.,Nie mam pieniędzy.
145028,433614,I don't have any money.,Je n'ai pas d'argent. | Je n'ai pas une thune. | Je n'ai aucune oseille. | Je n'ai pas un kopeck. | Je n'ai pas un fifrelin. | Je n'ai pas un sou vaillant. | Je n'ai aucun blé. | Je n'ai aucun argent.,Nemám žádné peníze. | Nemám žádné Pfennig. | Nemám žádné müde Mark. | Nemám žádné roten Heller.,"Nemám žádné peníze, vůbec. | Nemám גרוש. | Nemám žádnou zástěru. | Nemám žádnou zástěru.",Non ho soldi. | Sono al verde. | Non ho denaro. | Io non ho denaro. | Io non ho soldi.,財布がすっからかんなんだよ。 | お金がまったくないの。 | お金がまったくないの。 | 金欠なんだ。 | 財布がすっからかんなんだよ。 | お金がまったくないの。 | お金がまったくないの。 | お金がないの。 | お金が全くないの。 | 財布がすっからかんなんだよ。,I have no money. | I have no money. | I have no money.,Wcale nie mam pieniędzy. | Nie mam żadnych pieniędzy. | Nie mam pieniędzy.
145061,433669,Do you have a fever?,As-tu de la fièvre? | Avez-vous de la fièvre?,Hast du Fieber? | Haben Sie Fieber?,మీరు חום ఉందా?,Ha la febbre? | Ha la febbre?,熱あるの? | 熱はありますか。 | あなたは熱あるのですか? | 熱あるの?,നീ കത്തിച്ചോ?,Czy masz gorączkę?
145065,433675,I'm serious.,Je suis sérieux.,Es ist mein Ernst. | Ich meine es ernst.,मैं गंभीर हूँ. | गंभीरता से. | मैं नहीं מתלוצצת.,Jsem vážný. | Já jsem vážný. | Já jsem vážný. | Já jsem vážný. | Já jsem vážný.,本気.,I'm serious.,Mówię poważnie.
145067,433680,That's enough.,அது போதுமானது! | C'en est assez! | Arrête! | Cela suffit. | Ça suffit. | C'est suffisant.,Das reicht. | Das ist genug. | Es reicht! | Es reicht.,पर्याप्त ודי. | पर्याप्त,Basta così. | È abbastanza. | È sufficiente.,いい加減にしろよ.,"行了,行了。",తగినంత.
145070,433689,Did you call?,As-tu appelé? | Tu avais appelé?,Hast du gerufen?,क्या है? क्या है?,है बुलाया? | है बुलाया? | तुमने बुलाया? | तु है बुलाया? | ले है बुलाया? | तुमने बुलाया?,ඔ呼びですか.,你打过电话了?,වොනීෂ්?
145093,433730,Of course!,ശരി! | Mais ouais! | Pour sûr. | Pardi!,Natürlich! | Selbstverständlich! | Auf jeden Fall! | Na klar! | Aber sicher doch!,निश्चय ही!,Certo! | Certamente!,もちろんです! | もちろん! | もちろん。 | もちろんです。,当然! | 当然哪!,തീര് ച്ചയായും!
145099,433745,Don't worry about it.,"别担心这件事,别担心这件事,别担心这件事,别担心这件事,别担心这件事,别担心这件事,别担心这件事",Machen Sie sich darüber keine Sorgen. | Mach dir darüber keine Sorgen! | Mach dir darüber keine Gedanken! | Kümmere dich nicht darum! | Mach dir nichts daraus!,| That's not your worry!,"别担心,别担心,别担心。",Don't worry. | Don't worry. | Don't worry. | Don't worry. | Don't worry. | Don't worry. | Don't worry. | Don't worry about that. | Don't worry. | Don't worry. | Don't worry. | Don't worry. | Don't worry. | Don't worry. | Don't worry. | Don't worry. | Don't worry. | Don't worry. | Don't worry. | Don't worry. | Don't worry. | Don't worry. | Don't worry. | Don't worry. | Don't worry. | Don't worry. | Don't worry. | Don't worry.,不要担心它。 不要为这事发愁。 別担心了。,Nie przejmuj się tym.
145100,433754,Follow him.,Suis-le! | Suivez-le!,അവനെ പിന്തുടര്!,குறிப்பாக: குறிப்பாக: குறிப்பாக: குறிப்பாக: குறிப்பாக: குறிப்பாக: குறிப்பாக: குறிப்பாக: குறிப்பாக: குறிப்பாக: குறிப்பாக: குறிப்பாக: குறிப்பாக: குறிப்பாக: குறிப்பாக: குறிப்பாக: குறிப்பாக: குறிப்பாக: குறிப்பாக: குறிப்பாக: குறிப்பாக: குறிப்பாக: குறிப்பாக: குறிப்பாக: குறிப்பாக: குறிப்பாக: குறிப்பாக: குறிப்பாக:,Seguilo. | Seguitelo. | Lo segua.,後をつけろ.,అతనికి అనుసరించండి.,Śledź go. | Idź za nim.
145112,433809,I'm very hungry.,J'ai une faim de loup. | J'ai très faim. | J'ai la dalle. | J'ai les crocs.,Ich habe großen Hunger. | Ich bin sehr hungrig.,"很抱歉,很抱歉,很抱歉,很抱歉。",Ho molta fame.,ものすごく腹がすいている。 | 超腹減った。 | 私、腹ペコなんだ。 | とても空いているの。 | とても腹がすいたよ。 | めっちゃ腹すいた。 | めっちゃ腹ペコだわ。 | とても腹がへっている。,| 我好饿。,Jestem bardzo głodny.
145121,433849,Speak clearly.,स्पष्ट रूप से बताओ स्पष्ट रूप से बताओ स्पष्ट रूप से बताओ स्पष्ट रूप से बताओ स्पष्ट रूप से बताओ,Sprechen Sie deutlich. | Sprich deutlich!,بات بבהירות.,Parla chiaramente. | Parla con chiarezza. | Parli chiaramente. | Parli con chiarezza. | Parlate chiaramente. | Parlate con chiarezza.,පැහැදිලිව කියන්න.,講清楚.,Mów jasno.
145123,433859,I've had enough.,"”“我够了,我够了,我够了,我够了,我够了,我够了,我够了,我够了,我够了,我够了,我够了,我够了,我够了,我够了,我够了,我够了,我够了,我够了,我够了,我够了,我够了,我够了,我够了,我够了。",Ich habe davon die Nase voll. | Ich hab die Faxen dicke. | Mir reicht’s! | Ich hatte genug. | Ich bin bedient.,यह मेरे लिए काफी था. | נמאס לי. | पानी तक पहुँच गया मन तक. | נמאס לי इस से. | सातתי इस से. | מאסתי इस से. | मैं काफी था.,Ne ho avuto abbastanza. | Já ne ho avuto abbastanza.,十分を受け取った。 | もうたくさんだ。 | もうおなかいっぱいです。 | もう懲り懲りよ! | もうこりごりだよ。,I've got enough. | I've eaten enough.,Mam dosyć.
145124,433863,I'm full.,Je suis repu! | Je suis rassasié!,Ich bin satt.,Jsem plná. | jsem plná. | jsem sedm. | jsem sedmná.,Sono pieno. | Sono piena. | Io sono pieno. | Io sono piena.,もう満腹です。 | お腹がいっぱいです。 | お腹がいっぱい。 | お腹がいっぱいだ。 | ごちそうさま。,我吃飽了。,Jsem plná.
145218,434224,Anything else?,Autre غوره شوی؟,Sonst noch etwas?,Ještě něco?,Qualcos'altro?,他に何かありますか。,තව මොනවත් තියෙනවද?,Coś jeszcze?
145227,434242,Are you hungry?,As-tu faim? | Avez-vous faim? | Tu as faim? | Vous avez faim? | Avez-vous faim? | As-tu faim?,Hast du Hunger? | Habt ihr Hunger? | Haben Sie Hunger? | Bist du hungrig?,మీరు רעב?,Máš slávu? | Máš slávu? | Máš slávu? | Máš slávu? | Sei affamato? | Sei affamata? | È affamato? | È affamata? | Siete affamati? | Siete affamati? | Siete affamate? | Máš slávu? | Lei má slávu? | Voi avete slávu? | Tu sei affamato? | Tu sei affamata? | Lei è affamato? | Lei è affamata? | Voi siete affamati? | Voi siete affamati?,Are you hungry? Are you hungry? Are you hungry? Are you hungry? Are you hungry?,You hungry? | You stomach hungry?,വിശക്കുന്നുണ്ടോ?
145232,434258,Are you thirsty?,Avez-vous soif? | As-tu soif? | As-tu soif? | Avez-vous soif?,क्या तुम Durst हो? | Bist du durstig? | Habt ihr Durst?,क्या तुम खाते हो? क्या तुम खाते हो?,ഹേയ് സെയ് ഹേയ് സെയ് ഹേയ് സെയ്,喉渇いた?,നിനക്ക് ദാഹിക്കുന്നുണ്ടോ?,Chce ci se pić?
